{
  "$schema": "https://json-schema.org/draft/2020-12/schema",
  "$id": "https://heaotang.local/schemas/health-manager/mvp90-m1/m1-lifestyle-template-signoff.v1.schema.json",
  "type": "object", "additionalProperties": false,
  "required": ["contract_version","decision_id","parent_decision_ref","scope","decision_status","executable","decision_maker","decision_date","version","signed_version","content_author","independent_reviewer_required","independent_reviewer_verification","template","premises","falsification_evidence","review_trigger","evidence_references","signer_role","signature_reference","pending_owner","missing_evidence","next_checkpoint","revision_request"],
  "properties": {
    "contract_version":{"const":"health-manager.mvp90-m1.lifestyle-template-signoff.v1"}, "decision_id":{"const":"M1-LIFESTYLE-TEMPLATE"}, "parent_decision_ref":{"const":"C4-H06"},
    "scope":{"const":"HM-MVP90-M1 adult synthetic-member safe lifestyle template only; does not accept C4-H06 globally"}, "decision_status":{"enum":["Accepted","Exact revision","Pending with owner"]}, "executable":{"type":"boolean"},
    "decision_maker":{"type":["string","null"]}, "decision_date":{"type":["string","null"],"format":"date"}, "version":{"const":"v1-proposed"}, "signed_version":{"type":["string","null"]},
    "content_author":{"type":"string","minLength":1}, "independent_reviewer_required":{"const":true}, "independent_reviewer_verification":{"const":"Schema cannot compare identities; conformance and platform review must prove content_author != template.reviewer before package acceptance."},
    "template":{"type":"object","additionalProperties":false,"required":["template_id","template_version","applicable_population","excluded_population","contraindications","allowed_content","forbidden_content","stop_conditions","human_transfer_conditions","reviewer","validity"],"properties":{
      "template_id":{"const":"HM-M1-SAFE-LIFESTYLE"},"template_version":{"const":"v1-proposed"},"applicable_population":{"type":"array","minItems":1,"uniqueItems":true,"items":{"type":"string"}},"excluded_population":{"type":"array","minItems":1,"uniqueItems":true,"items":{"type":"string"}},"contraindications":{"type":"array","minItems":1,"uniqueItems":true,"items":{"type":"string"}},"allowed_content":{"type":"array","minItems":1,"uniqueItems":true,"items":{"type":"string"}},"forbidden_content":{"type":"array","minItems":5,"uniqueItems":true,"items":{"type":"string"}},"stop_conditions":{"type":"array","minItems":1,"uniqueItems":true,"items":{"type":"string"}},"human_transfer_conditions":{"type":"array","minItems":1,"uniqueItems":true,"items":{"type":"string"}},"reviewer":{"type":["string","null"]},
      "validity":{"type":"object","additionalProperties":false,"required":["effective_from","expires_at","validity_policy_ref"],"properties":{"effective_from":{"type":["string","null"],"format":"date"},"expires_at":{"type":["string","null"],"format":"date"},"validity_policy_ref":{"const":"config://health.template.validity-policy"}}}
    }},
    "premises":{"type":"array","minItems":1,"uniqueItems":true,"items":{"type":"string"}},"falsification_evidence":{"type":"array","minItems":1,"uniqueItems":true,"items":{"type":"string"}},
    "review_trigger":{"type":"object","additionalProperties":false,"required":["events","review_date"],"properties":{"events":{"type":"array","minItems":1,"uniqueItems":true,"items":{"type":"string"}},"review_date":{"type":["string","null"],"format":"date"}}},
    "evidence_references":{"type":"array","minItems":1,"uniqueItems":true,"items":{"type":"string"}},"signer_role":{"const":"和奥堂医生集团专业负责人"},"signature_reference":{"type":["string","null"]},
    "pending_owner":{"type":["string","null"]},"missing_evidence":{"type":["array","null"],"minItems":1,"uniqueItems":true,"items":{"type":"string","minLength":1}},"next_checkpoint":{"type":["string","null"]},"revision_request":{"anyOf":[{"type":"null"},{"$ref":"#/$defs/revision_request"}]}
  },
  "$defs":{"revision_request":{"type":"object","additionalProperties":false,"required":["target","replacement_text","professional_reason","owner","reverification_conditions","reverifier"],"properties":{"target":{"type":"string","pattern":"^(\/|section:|action:|scenario:).+"},"replacement_text":{"type":"string","minLength":1},"professional_reason":{"type":"string","minLength":1},"owner":{"type":"string","minLength":1},"reverification_conditions":{"type":"array","minItems":1,"uniqueItems":true,"items":{"type":"string","minLength":1}},"reverifier":{"type":"string","minLength":1}}}},
  "allOf":[
    {"if":{"properties":{"decision_status":{"const":"Pending with owner"}},"required":["decision_status"]},"then":{"properties":{"executable":{"const":false},"decision_maker":{"const":null},"decision_date":{"const":null},"signed_version":{"const":null},"signature_reference":{"const":null},"pending_owner":{"type":"string","minLength":1},"missing_evidence":{"type":"array","minItems":1},"next_checkpoint":{"type":"string","minLength":1},"revision_request":{"const":null},"template":{"properties":{"reviewer":{"const":null},"validity":{"properties":{"effective_from":{"const":null},"expires_at":{"const":null}}}}}}}},
    {"if":{"properties":{"decision_status":{"const":"Accepted"}},"required":["decision_status"]},"then":{"properties":{"executable":{"const":false},"decision_maker":{"type":"string","minLength":1},"decision_date":{"type":"string","format":"date"},"signed_version":{"type":"string","minLength":1},"signature_reference":{"type":"string","minLength":1},"pending_owner":{"const":null},"missing_evidence":{"const":null},"next_checkpoint":{"const":null},"revision_request":{"const":null},"template":{"properties":{"reviewer":{"type":"string","minLength":1},"validity":{"properties":{"effective_from":{"type":"string","format":"date"},"expires_at":{"type":"string","format":"date"}}}}}}}},
    {"if":{"properties":{"decision_status":{"const":"Exact revision"}},"required":["decision_status"]},"then":{"properties":{"executable":{"const":false},"decision_maker":{"type":"string","minLength":1},"decision_date":{"type":"string","format":"date"},"signature_reference":{"type":"string","minLength":1},"pending_owner":{"const":null},"missing_evidence":{"const":null},"next_checkpoint":{"const":null},"revision_request":{"$ref":"#/$defs/revision_request"}}}}
  ]
}
